id,regional_name,name,description,interesting_facts,country
176,Spanish,Vin rouge d'Espagne,"The savory red wines of Spain are brooding and complex. They are typically a little lighter than a California Cabernet, but richer and fuller than a Pinot Noir.

The most commonly used red grapes in Spain are the lovely Tempranillo grape and the rich Garnacha, but Cabernet Sauvignon is starting to get popular as well.

The main grape in Spain is Tempranillo, which is followed closely by Garnacha. In the past, Spanish reds were know to be worthy of aging for decades and were very expensive because of this. Now that technology is more available they are making more affordable, fruitier wines.

The most famous red wine in Spain is Rioja and it is made from the Tempranillo grape. Rioja is usually very complex and savory. Another famous wine is Priorat which is made largely from Garnacha and lush with dark fruit, spice, and vanilla.

Sometimes Rioja and Priorat wines can be very pricey due to their long aging, but often those same wineries make much more affordable wines that are aged for less time, but are still delicious!","Spain has the most land dedicated to vineyards of any country in the world!
Spain is known for using American Oak barrels instead of French Oak barrels, because the wood was readily available to them after they started colonizing the new world.
Spanish vineyards are typically planted with the vineyard rows very far apart.
The three categories for how long a Spanish red wine is aged before bottling are the following: Crianza (2 years), Riserva (3 years), and Gran Riserva (5 years).
The two most commonly planted red wine grapes in Spain are Tempranillo and Garnacha.",es
14,Chilean,Assemblages Bordeaux (Chili),"Chile is producing world class Bordeaux blends that can compete with the very best in the world.

These Merlot and Cabernet Sauvignon based wines are full of structure, tannin and body, just like their counterparts in Bordeaux and Napa. However, winemakers here tend to focus more on creativity and innovation in producing their blends.

The additions of Carménère, Petite Verdot, Malbec, and Cabernet Franc allow for a wide range of styles within this category. Due to the lack of strict regulations there is a blend to suit most any preference!

These bold red wines have even begun winning blind tasting competitions against established international regions.

Although Chile's wine heritage is closely linked to that of Bordeaux, they are not hindered by the same regulations. Here, winemakers are allowed freedom to produce world class wines without stringent guidelines.

As with other wines from Chile, there are outstanding values to be had in this category, largely due to lower real estate prices and favorable exchange rates. While Bordeaux blends don't generally come cheap, Chile is an obvious place to search for premium quality wines at reasonable price points.","Pour une région productrice de vin du Nouveau Monde, l'histoire du Chili est relativement longue qui remonte au 16ème siècle.
Les cépages bordelais ont été implantés au Chili au milieu du XIXe siècle.
Les cépages les plus couramment cultivés au Chili sont toutes les variétés de Bordeaux, y compris Cabernet Sauvignon, Merlot et Carménère.
En 2004, l'assemblage de Bordeaux Chilien de la région d'Aconcagua à fini devant un Château Lafite et un Château Margaux lors d'une dégustation à l'aveugle à Berlin.",cl
57,Chilean,Chardonnay (Chili),"Chardonnay is the third most widely planted grape in the world, and its cultivation is viewed as being the “rite of passage” for any emerging wine growing region.

Chilean Chardonnay thrives in the cooler areas, and tends to have moderate acidity, tropical fruit notes and a striking minerality.

Chardonnay has its origins in the famous Burgundy region of France. It is an extremely versatile grape and grows in abundance all over the world.

Chilean Chardonnay is a cool climate specialist. The regions of Limari, San Antonio and Casablanca have become well known for their fabulous (and very reasonably priced) Chardonnays.

A Chilean Chardonnay won't taste like Napa Chardonnay. It is more similar to a Sauvignon Blanc but with more tropical fruit and apple-pear flavors. Given the heavy minerality and noticeable acidity, Chilean Chardonnay should pair nicely with dense fish dishes, white meats and possibly some scallops or lobster.","Le chardonnay est le raisin blanc le plus largement planté au Chili.
When people say that Chardonnay's are ‘buttery' it means that they have been aged for a while in oak.
Les faibles précipitations, les hauts rayons du soleil et les faibles températures du soir font du Chili l'un des meilleurs pays pour cultiver du Chardonnay.
Les cépages les plus courants du Chili sont le Cabernet Sauvignon, le Merlot et e Carménère.
La production chilienne a été influencée en grande partie par la région bordelaise en France, même si elle a ses racines en Espagne.
Les fluctuations de température au Chili en raison de la proximité des Andes, permettent aux raisins de conserver leur acidité lorsqu'ils poussent sur la vigne.",cl
264,Bordeaux Left Bank,Pauillac,"Bordeaux Pauillac wines are rich and concentrated, full-bodied reds with grippy tannins, and characteristic notes of cassis, cedar and cigar box spice.

The best examples come from blends with a base of high-quality Cabernet Sauvignon and are often considered the quintessential example of a Bordeaux wine.

Pauillac, in Bordeaux's Left Bank Médoc region, boasts well-draining gravel soils, which in turn translates to higher quality wines; and those from Pauillac age extremely well.

Three of the five first-growths from the 1855 classification of the Médoc are situated in Pauillac: Lafite, Latour, and Mouton-Rothschild.","Though Pauillac boasts some of Bordeaux's most acclaimed estates, the town itself is very small.
More than half of the 18 classified 'Fifth-Growths' are in Pauillac, including the famous Château Lynch-Bages.
Château Mouton-Rothschild, which encompases 90 hectares (222 acres) in Pauillac was elevated from a 'Second-Growth' to a 'First-Growth in 1973—the only time in the history of the 1855 Classification that a winery's classified position was re-evaluated.",fr
94,Languedoc-Roussillon,Vin rouge du Languedoc-Roussillon,"Le vin de la région Languedoc-Roussillon est produite dans le sud de la France, allant de la côte méditerranéenne à la Provence. Cabernet, Merlot, Mourvèdre, Grenache et Syrah figurent parmi les raisins rouges les plus importants de la région.

La plupart des producteurs de vin dans cette région produisent des mélanges et non pas des vins de monocépage. Il y a quelques valeurs exceptionnelles se trouvent dans les vins de cette région. Un grand nombre de vins rouges de cette région peuvent être acquis pour moins de 15 € !

 Le Languedoc-Roussillon est la région qui produit le plus de vin au monde, on y élabore plus d'un tiers de la production de vin français.

Bien que la région fût connue pour produire du vin de table peu cher par le passé, de nombreux vignobles et coopératives remplacent les vignes de moins bonne qualité au profit de variétés de vin de meilleure qualité et de méthodes de production. La qualité a été constamment améliorée depuis les années 1970, lorsque la région a été surtout connu pour le barattage de vin au pichet pas cher.

Les deux régions du Languedoc-Roussillon produisent différents styles de vin rouge, bien qu'ils fassent partie de la même famille. Le Languedoc est connu ses vins fruités et corsés qui peuvent être assez complexe parfois. Le Roussillon produit des mélanges plus mûres et plus intenses, ainsi que des vins de vendanges tardives et des vins enrichis en alcool.","Aussi récemment qu'en 2001, la région a produit plus de vin que l'ensemble des États-Unis.
Pendant les guerres mondiales, l'armée française a reçu ses rations quotidiennes de vin de cette région.
La région est l'une des plus anciennes régions viticoles en France, elle remonterait au moins à 6000 ans avant JC.
Au cours du 14ème siècle, les vins de la région ont été prescrits par les médecins et les hôpitaux pour aider les divers maux.",fr
5,Italian,Barbaresco (Italie),"Dans la région du Piémont dans le Nord de l'Italie, le cépage Nebbiolo est de loin le meilleur.  Il s'exprime dans deux vins : le Barolo, intense et charpenté, et le Barbaresco, élégant et surprenant.

Le Barbaresco est a souvent une robe limpide, et des notes de petites baies acidulées, de terre sèche, d'épices et de pot-pourri.

Le Nebbiolo produit des vins puissants. Le Barbaresco est son expression la plus féminine et élégante, mais il peut être aussi enthousiasmant et exaltant qu'un Barolo.

Ces vins ont des taux d'acidité et de tannicité hauts, ils peuvent donc être bus au moins deux ans après mise en bouteille. Après quelques années de vieillissement en bouteille, ils révèlent des arômes stupéfiants de cranberry et de cérise acidulées, de cardamome, pot-pourri et de terre sèche. Ils sont généralement d'un rouge orangé plus limpide, mais leurs saveurs ne perdent pas de leur expression.

Si vous souhaitiez trouver un Pinot Noir avec l'ardeur d'un Carbernet, ce vin est fait pour vous !","Barbaresco est situé dans la région Piémont au nord de l'Italie. 
Le Barbaresco doit être âgé d'au moins d'un an en barrique et pas moins d'un an en bouteille avant qu'il soit mis sur le marché.
En raison de sa position à l'est de Barolo, les raisins mûrissent en Barbaresco un peu plus tôt qu'en Barolo.
Barbaresco est le village du célébrissime Gaja qui a commencé à faire ce vin en 1859.
En raison de leur tanin et de leur acidité, les vins Barbaresco peuvent vieillir pendant pas mal d'années, mais pas aussi longtemps que du Barolo.",it
171,Spanish,Priorat (Espagne),"The traditional grape grown in this region is Garnacha (or Grenache). Small plantings of Carignan, Cabernet Sauvignon, Merlot and Syrah are common as well.

Wines crafted from Garnacha are often described as intense, rich and powerful. In the Priorat, the wines are especially so, due in part to unique black volcanic soils and long, hot summers.

As with much of the Old World, grapes have been cultivated in the Catalonian Priorat for a long time, since the 12th century, under the care of the Carthusian monks.

The region's vineyards were decimated by phylloxera at the turn of the century, and they were not replanted until the 1950s.

Thankfully, in the late 1980s a group of energetic, young winemakers revitalized this remote and rugged DOQ (Denominació d'Origen Qualificada). Today, Priorat is thought to be one of the top wine-producing regions in Spain, and the wines are highly sought after and can be expensive.

Garnacha wines are typically quite dark in color, with a high alcohol, and blackberry and fig notes. Spicy accents along with mineral, espresso, orange peel and savory notes are common as well. Pair these expressive, full-bodied reds with grilled lamb or beef, wild boar, sausages or hearty winter stews.","In France, Garnacha is called Grenache.
There are only two wine growing regions in Spain with the prestigious DOCa designation, the highest qualification level—they are the Rioja and Priorat.
The name Priorat hails from the word priory, a nod to the dedicated monks who established the region centuries ago.
Grenache is one of the most widely planted grape varieties in the world and can trace its origins to Catalonia. Well-suited to hot, dry climates, it's right at home in the Priorat.
Priorat has a unique soil type known as known as llicorella. A combination of volcanic slate and quartz that can seriously retain heat, think of asphalt on a hot summer day.",es
265,Bordeaux Left Bank,Saint-Julien,"Saint-Julien offers balanced, age-worthy blends of Cabernet Sauvignon and Merlot, with deep ruby colors and notes of cassis and cedar.

Depending on the producer, some style are more perfumed while others exude more power.

Situated between the widely popular communes of Margaux and Pauillac in the Médoc of Bordeaux's Left Bank, Saint-Julien combines the elegance of the former with the boldness of the latter.

Often times Saint-Julien can be mistaken for Pauillac; however, rarely do Saint-Julien wines match their intense concentration.","Saint-Julien is the smallest appellation within the Médoc.
Saint-Julien boasts the most classified terroir within any Bordeaux appellation.
While Saint-Julien doesn't contain any 1855 classification First Growths, it does have five Second-Growths, two Third-Growths and four Fourth-Growths.
Third growth Leoville-Barton in Saint-Julien is the only château that is still in the hands of the family that ran it at the time of the 1855 classification.",fr
226,Australian,Syrah (Australie),"Australia's most popular grape varietal, Shiraz is full-bodied with high alcohol, and vibrant berry and plum on both the nose and palate. Australia's hot summers and cooler winters impart a complexity and structure that collects well and is a worldwide favorite.

Shiraz is described as robust and spicy with a slightly sweet finish. You will also enjoy a velvety and slightly syrupy mouthfeel when enjoying this varietal.

Genetically identical to French Syrah, these grapes migrated to Australia in the 19th century and flourished taking on characteristics of indigenous flora. It is not uncommon to taste notes of Eucalyptus when enjoying this wine.

Growing to commercial prominence in the last decade of the 20th century, Shiraz is a fan favorite the world over and is a great wine for drinkers of different levels of experience.

Peppery and deep, enjoy this wine with flavorful spicy foods from steak, to mediterranean and even latin cuisines. This wine can overpower more subtle dishes, so be cautions to avoid lighter proteins and unspiced seafood.","Syrah and Shiraz are genetically identical.
Syrah means princess in Arabic.
Shiraz is properly pronounced with a short a - as in Shiraaaz.
Australia produces more Shiraz than any other New World country.",au
239,Italian,Vino Nobile di Montepulciano (Italie),"You may not be familiar with Vino Nobile di Montepulciano, but you should be. Despite its long name, it makes delicious wines filled with preserved red cherry flavors.

Similar in style to Chianti due to it being mostly made from Sangiovese, this is a great option if you love Tuscan wines and want something a little more refined.

The wines of Tuscany's Vino Nobile di Montepulciano enjoy a storied history dating back to the 8th Century. Receiving praise from Popes and poets as “the king of wines”, it is no wonder it was one of the first regions in Italy given DOCG status.

The wine is similar to the nearby Chianti Classico, but it tends to be a little fuller and higher in alcohol. It typically showcases lots of red cherry jam and forest floor, and can be as good as some of the best Chianti Classicos.

It is not as dark or rich as Brunello di Montalcino, but it is typically much more affordable. If you are looking for a new Italian wine to try, this is a great bet.","Vino Nobile di Montepulciano was one of the original four DOCGs created in 1980.
By law, the wines must be aged for 2 years to be called Vino Nobile and 3 years to qualify as Riserva.
La région de Montepulciano est plus chaude que le reste de la Toscane.
Vino Nobile di Montepulciano must contain at least 70% Prugnolo Gentile (aka Sangiovese).",it
263,Bordeaux Left Bank,Margaux,"Bordeaux Margaux wines tend to be deep ruby in color, perfumed and floral, particularly with notes of violets and lilacs, and soft, silky tannins.

Less masculine and powerful than wines from other regions of Bordeaux, Margaux wines are typically more refined and elegant.

Margaux is the furthest south appellation in the Médoc in Bordeaux's Left Bank and boasts many soil types, including limestone, chalk, clay, sand and gravel, meaning style and quality of Margaux can vary dramatically.

The best Margaux wines come from grapes planted on gravel soils with good drainage.","Margaux has the most chateaux included in the 1855 Classification of the Médoc and Graves.
Chateau Margaux and Chateau Palmer are consistently considered the best wines out of Margaux.
Margaux is believed to be home to the first planting of vines by the Romans.
As the warmest region of the Left Bank, harvest typically comes earliest in Margaux.",fr
181,Alsace,Riesling (Alsace),"Rarement vieilli en fût, les vins Alsaciens “Riesling” sont généralement secs et vifs, avec une forte acidité (faible PH) et des arômes puissants de poire, de pomme, de citron, de fleurs et d’épices.   La région produit également des versions demi-sec généralement étiquetées comme Vendange Tardive (VT) et Sélection de Grains Nobles (SGN ) qui signifie que les raisins ont été atteints de pourriture noble. L'Alsace est une région viticole située dans le nord-Est de la France, proche de la chaîne montagneuse des Vosges et à l'est du Rhin, à la frontière de l'Allemagne. Cette situation géographique, fait que l’Allemagne et l’Alsace ont de nombreuses variétés de raisins en commun.  Le Riesling est le “chouchou” des vins d'Alsace, et un des préférés des amateurs de vin dans le monde car il est à la fois polyvalent et peu onéreux.Les Rieslings sont des vins de terroir, doux et dynamique, avec un coté minérale très intéressant.   Cela est dû, en partie, au climat froid, sec et ensoleillé ainsi que de la spécificité des sols de la région; un mélange de granit, de calcaire, de schiste et de grès.  Un des avantages du Riesling, à la fois dans sa version sec et demi-sec, est qu'il peut accompagner une grande variété de plats.  Essayez le riesling sec avec des tacos au poisson, des sushi, du poisson fumé, des asperges et, un de nos favoris, le fromage de chèvre.   Le demi-sec quant à lui accompagnera très bien de la nourriture thaï, un curry, des crevettes cocktail et, un autre de nos favoris, la tarte aux pommes.","Le Riesling est à l'origine de la région du Rhin de l'Allemagne, et est parfaitement chez lui en Alsace, qui se trouve à l'est de la rivière.
""Terroir"" est un terme français utilisé pour décrire les caractéristiques conférées aux raisins lié au sol et au climat de la terre dans laquelle il a été cultivé.",fr
208,Southern Italy,Vin rouge d'Italie du Sud,"Southern Italy is the toe, heel, and ankle of the Italian “boot” where we find the regions Campania, Basilicata, Puglia, Calabria, and Sicily as well as the distant relative Sardegna. There are scores of fascinating indigenous grape varieties here, different winemaking traditions and styles are defining each region, and the wines are often less expensive than their Northern counterparts.

Puglia and Sicily are producing huge volumes of wine, and they are battling to be the second biggest wine producing region in Italy. The hot climate is reflected in the wines and they are famous for their inexpensive, full bodied, warm, and fruit forward red wines based on Primitivo and Nero d’Avola. Less famous yet very interesting are the Sicilian wines from Mount Etna. The higher altitude yields wines that are lighter, fresh and complex. The indigenous grape Nerello Mascalese offers some fine examples.

In Campania and the northern part of Basilicata, winemakers have been finding success with the grape Aglianico (pronounced “ahl-YAH-nee-koe”). The slightly colder climate is ideal for this grape and produces wines that are garnet-colored with high tannins and acidity. Harsh when young, but after some aging they become elegant and complex, and reveal lovely plummy flavors with a hint of chocolate.

In Sardegna they lean more towards the grapes Carignano and Cannonau with French/Spanish origin. The wines here are often powerful with a spicy touch.","The soil in Southern Italy is largely volcanic and also granitic.
Southern Italy receives very little rain and is extremely sunny. It is the hottest and driest region of Italy.
The best vineyards in the area are high in elevation on the north-facing hillsides, where they don't get as much sun.
The best known wine of Campania is called Lacryma Christi which means “the Tears of Christ.”
Mount Vulture is just north of the city of Potenza in Basilicata. It is an extinct volcano!",it
130,Northern Italy,Vin rouge d'Italie du Nord,"The wines of Northern Italy include some of the most well known red wines in the country including Nebbiolo, Barbera, Dolcetto, Amarone and Valpolicella.

Arguably, the two most important regions in Northern Italy are Piedmont in the northwest, and Veneto in the northeast. Red wines from these regions range from some of the most expensive and sought after in all of Italy to great value red wines.

Nebbiolo produces some of the most exclusive and expensive red wines in Italy, including Barolo and Barbaresco. However, these sought after wines come with a hefty price tag.

Dolcetto and Barbera from Piedmont offer relative value. Dolcetto is planted on less desirable vineyard sites, and produces fruit-forward, great value wines that are meant to be consumed within 1-2 years of bottling. Barbera is a high yield variety with low tannins and high acidity.

In Veneto, Valpolicella reigns supreme as its own distinct viticultural zone. There are five different tiers within this wine category ranging from inexpensive and light-bodied Valpolicella Classico, to pricey Amarone.

Red wines from Valpolicella are typically based on Corvina, with Rondinella, and Molinara rounding out these blended wines.","Jusqu'au 20 dernières années, Barbera était la variété de rouge la plus largement plantée dans toute l'Italie.
De nombreuses variétés de vin du nord de l'Italie sont maintenant plantées en Californie.
L'Italie produit plus de vin que tout autre pays, représentant près de 1/​3 de la production mondiale.",it
157,Californian,Pinot Noir (Californie),"Pinot Noir has the well deserved reputation of being a finicky and difficult grape to cultivate. It thrives in cooler climates like Burgundy and the Willamette Valley in Oregon, but is also widely planted throughout sun-drenched California.

Pinot Noir reflects its terroir, or place of origin, more than just about any other variety. That's certainly part of its broad appeal, and right now, there is revolution happening in California.

In Pursuit of Balance or IPOB is a thriving group of producers founded on the notion that California Pinot Noir should be balanced, rather than decadent and lush—the prevailing style over the past few decades. Has the focus shifted? There are compelling arguments on both sides of the issue.

It pays to do a little research, then, to figure out which producers are making fully ripe, high octane Pinots and those that are making a style that accents subtlety and vibrant acidity. Not that both styles can't be great, they can be.

Richer Pinot Noir, from warmer regions like the Russian River Valley tends to exhibit more dark fruit, in general, they are fuller wines with greater concentration and higher alcohol, up to 15% ABV.

Pinots from cooler regions like Sonoma Coast are lighter-bodied and display more red fruit, floral notes and have brighter acidity, often with a dash of minerality. Alcohol percentage and even the color of the wine can clue you in when shopping.","“Sideways” catapulted California Pinot Noir to stardom, since the release of the hit movie in 2004, Pinot Noir production has grown by a whopping 81%.
Oregon is renowned for its Pinot Noir, but California actually produces more.
Prone to genetic mutation, Pinot Noir has more known clones than any other grape variety, certainly more than Dolly the sheep.
Pinot Noir is widely regarded as one of the most romantic wines, it is often described as perfumy and sweet, despite being a dry wine.",us
7,Italian,Barolo (Italie),"Barolo is a delicious red wine from the Piedmont region of Northern Italy. It is made strictly from Nebbiolo grapes.

Aromatic with rich tannins and characteristics of old oak, these wines are considered by most to be some Italy's finest.

Traditionally a wine enjoyed by gentry, Barolo grows in the region's finest plots of soil.

This wine is robust with evident notes of red flowers on the nose. The palate will enjoy significant acid and strong, long, earthy finish. These wines collect well, although consult a specialist to get a hold of of the best vintages.

Pair this food with big and flavorful pastas, or proteins - steak and well-spiced veal. Avoid underseasoned vegetables, leafy greens, or seafood.

The Nebbiolo grape does not travel well and is high maintenance, which is why it has never thrived quite as well elsewhere as on the Piemontese slopes. Like its top contender, Pinot Noir, Nebbiolo takes kindly to its terroir, thus displaying the subtleties of its environment.","Le Barolo est l'un des vins les plus chers d'Italie.
Le Barolo est appelé ""Le roi des vins.""  Il est aussi appelé le «vin des rois.""
Le Barolo est vieilli pendant plus de 5 ans - habituellement 3 d'entre eux en fut de chêne. Le vin peut prendre encore de nombreuses années pour s'adoucir.
Le Barolo est fait à base du cépage Nebbiolo, dont le nom provient du mot ""nebbia"", le brouillard en italien.",it
