id,regional_name,name,description,interesting_facts,country
262,Bordeaux Left Bank,Médoc,"Médoc wines tend to be ruby in color, balanced and well-rounded on the palate with notes of cassis, cherries and earth, with firm tannins.

While most Bordeaux wines require aging, those labeled simply 'Médoc' tend to be lighter in style and more approachable in their youth.

Grown on gravel rich soils in the Left Bank of Bordeaux, wines from the Médoc are predominantly Cabernet Sauvignon and Merlot blends, but sometimes see the addition of Petit Verdot and Malbec.","The Médoc is the wettest region in Bordeaux—rot is a regular threat and necessitates spraying.
Out of thousands of wine regions around the globe, Bordeaux's Médoc region is the most famous, revered for its gravel soils. Gravel provides for excellent drainage while also retaining heat, which aids in the ripening of thick-skinned black grapes like Cabernet Sauvignon.
Believing there would be increased demand for red Bordeaux, growers planted the whole of the Médoc aggressively in 1990s and early 2000s. Their prediction was wrong, and many ended up in financial difficulty as a result.
Only red wines are permitted to be made in the Médoc.",fr
276,Bordeaux Left Bank,Saint-Estèphe,"Les vins de Saint-Estèphe sont puissants, concentrés et riches, avec parfois des tannins austères, graveleux dans leur jeunesse, et sont marqués de notes de cassis, de tabac, de cigare et de pierre concassée.

Ces mélanges corsés de Cabernet Sauvignon et de Merlot peuvent très bien vieillir.

Saint-Estèphe est situé à l'extrémité nord du Haut Médoc bordelais, avec des raisins cultivés sur des sols de gravier reposant sur une base d'argile. Les sols ont un faible drainage, ce qui retarde la maturité, et il en résulte souvent des vins d'une plus grande acidité que ceux provenant de plus au sud du Médoc.","Saint-Estèphe est l'appellation située la plus au nord du Médoc, plus froid et souvent la dernière région à récolter.
Saint-Estèphe est la plus grande des appellations du Médoc.
Les plantations de Merlot ont augmenté à Saint-Estèphe
Un petit ruisseau sépare la région de Saint-Estèphe du Premier Cru Château Lafite provenant du village voisin de Pauillac.",fr
32,Californian,Cabernet Sauvignon (Californie),"Known as the king of red wine grapes, Cabernet Sauvignon enjoys the same regal status in California as does in its native home in Bordeaux.

The most widely planted red wine grape in California, Cabernet Sauvignon commands the highest price per ton and is the dominant grape found in some of California's most prestigious brands.

Some of the most expensive wines in the United States are made from this noble grape. Cult wines like Screaming Eagle and Harlan Estate sell for thousands per bottle, but don't let that scare you—great non-cult Cabs can be found for much less, starting at around $20. Top growing regions include Napa Valley and Sonoma County.

Cabernet Sauvignon is dry and full-bodied, and is prized for its long aging potential. It's also known for displaying characteristic green flavors like bell pepper, eucalyptus and mint. Cabernet grown in California tends to be more fruit-forward and more mellow, with rich dark fruit notes of blueberry and blackberry as well as earth, dust, mocha and cedar.

The moderate to high tannin levels and concentrated flavors in Californian Cab make it a sensational food wine. It's superb with porterhouse steak, braised pork belly, hearty lamb stews, portobello mushrooms and grilled burgers.","Des tests ADN ont prouvé que le Cabernet Sauvignon est un croisement entre le Cabernet Franc et le Sauvignon Blanc.
In the famous 1976 Judgement of Paris tasting, California's Stag's Leap Wine Cellars beat top Bordeaux estates like Mouton Rothschild in a blind tasting.
Le vin américain le plus culte est le Screaming Eagle. Six magnums de Screaming Eagle 1992 ont atteint la somme record de 500 000 $ à une vente aux enchères.
Le critique de vin, Robert Parker a attribué un ""parfait"" 100 points à seulement 369 vins depuis qu'il a commencé à examiner les vins dans les années 1970. Environ 20% de ces 100 pointeurs sont des Cabs de Napa Valley.
Le seul autre cépage qui est plus largement planté en Californie est le Chardonnay.",us
163,Oregon,Pinot Noir (Oregon),"Light to medium-bodied, Oregon Pinot is more finely boned than California Pinot, and displays a wide, aromatic range of flavors including strawberry, raspberry, delicate floral notes, and earthier notes like mushroom and truffle.

As with other famous regions that produce this Noble grape, Oregon's Pinot Noir can be as sophisticated and compelling as a fine red Burgundy.

While the wine industry in Oregon is relatively young, world-class wines, especially Pinot Noir have come from this cool climate region for years.

The heart of the Oregon wine industry lies in the Willamette Valley, and has a similar latitude and climate as Burgundy. Pinot Noir first made its way to this picturesque region in 1959, thanks to the man who is widely credited as the father of Oregon Pinot Noir, Richard Sommers. He planted the first vines in Umpqua Valley and later established HillCrest Vineyard in Roseberg, in 1961.

Pinot Noir is challenging to grow, it's a small vine with tight clusters, and is susceptible to issues like rot and mildew. Known as the “heartbreak grape”, it can be a headache for winemakers and vineyard managers alike, yet is grown all over the world, and can command higher prices than other varieties for this reason.

Oregon Pinot is excellent paired with pork tenderloin, duck, cedar plank salmon, and just about anything with wild mushrooms.","Pinot Noir translates as black pine, the grape is aptly named, as it forms tight clusters of purple-black fruit that are pine cone shaped.
Pinot Noir readily reflects its terroir, or the soil and climate in which it is grown. Many Oregon Pinots have a minerally note that shines through, along with bright acidity.
Pinot Noir is not only fickle, it's also prone to mutation, there are hundreds of known clones.
Many Oregon winegrowers pride themselves on sustainable and organic practices, if you're into organic, Oregon Pinot has much to offer.",us
192,Italian,Ripasso (Italie),"The wines retain the vibrancy, freshness and value of traditional Valpolicella, while imparting additional flavor and body.

Their medium body and complex flavor profile make these wines a great pairing with a wide range of foods such as grilled meats, hearty pasta and strong cheeses.

Ripasso della Valpolicella is a red wine from the Veneto region of Italy. The wine is produced by putting Valpolicella Classico under a second fermentation by adding the skins remaining from Amarone and Recioto production.

This winemaking process imparts additional complexity, tannin, body, and slightly higher alcohol to the wine. Both the body and price point of this wine are somewhere between a Valpolicella Classico and a true Amarone.

Ripasso wines are more approachable on both the palette and the wallet! They retail at far more accessible price points than true Amarone- generally in the $15-$25 price range.

Ripasso della Valpolicella is a wine based on the Corvina grape, with the addition of Rondinella and Molinara rounding out the blend.

In 2009, Ripasso della Valpolicella received its own DOC designation, along with its cousin, Amarone. In fact, they are sometimes known as “baby Amarone.”","The term Ripasso means “repassed,” which refers to the production technique.
The Ripasso method, which is widely used, only recently began to appear on wine labels, as a result of much dispute and an eventual lawsuit.
Winemaking in Valpolicella has existed since the ancient Greeks.
This winemaking region is known as “the pearl of Verona”.
Valpolicella ranks just after Chianti in total Italian (DOC) wine production.",it
159,Chilean,Pinot Noir (Chili),"Pinot Noir is never a straightforward varietal. Eternally fussy, and extremely fickle, this wonderful grape does fit nicely into the cooler climates of Chile.

Chilean Pinot Noir exudes cherry, cranberry and strawberry, and tends to follow the much-lauded mantra of “less is more” as they pursue a balanced, subtle wine.

Pinot Noir is the flagship red grape of France's Burgundy region. It's a thin-skinned varietal that thrives in cooler regions all over the world. It tends to grow in thick clusters, which makes it susceptible to rot and disease.

Casablanca, San Antonio and Bio Bio are regions that are excelling in the Pinot Noir game at the moment, and many of the wines from these regions are regarded to be showing a lot of potential for the future.

Being lighter in body and high in acidity, Chilean Pinot Noir should be paired with something like light tomato-based dishes or some roast chicken.","Pinot Noir was the darling wine of the movie Sideways, and has been hugely popular ever since.
Pinot Noir, along with the white grape Chardonnay, is often the primary grape used in Champagne.
Chilean wines are regarded to be some of the best bargains in the wine world!",cl
261,Bordeaux Left Bank,Pessac-Léognan,"Blended from Cabernet Sauvignon and Merlot, Pessac-Léognan wines are beautifully balanced with fine-grained structured tannins, and exhibit classic notes of tobacco, cassis, dark cherry, leather and tar, as well as a distinctive minerality.

Some of the best wines are described as smoky and have hints of truffle.

Located within the wider Graves appellation in Bordeaux's Left Bank, Pessac-Léognan boasts the region's best soils; the resulting wines have excellent aging potential.

Pessac-Léognan also makes whites from Sauvignon Blanc and Sèmillon.","Pessac-Léognan is the youngest Bordeaux appellation, having only been recognized since 1987.
Chateau Haut-Brion is located in Pessac-Léognan, the only First Growth in the 1855 classification outside of the Médoc.
Though the majority of wines produced in Pessac-Léognan are red, the region also produces white Bordeaux.
Pessac-Léognan is named after the distinctive gravel soils found in the region.",fr
83,Alsace,Gewürztraminer (Alsace),"L'Alsace est une région viticole du nord de la France, située aux frontières de l'Allemagne. L'Alsace étant blottie entre la chaîne des Vosges et l'Allemagne, à l'est du Rhin, on y trouve de nombreuses variétés de raisin.

Le Gewurztraminer est un cépage d'Alsace, c'est la deuxième variété la plus plantée de la région.

C'est un cépage très aromatique avec des senteurs très caractéristiques de fruits exotiques comme le litchi, la carambole, les fruits de la passion ou la mangue. À ces notes de fruits exotiques viennent s'ajouter d'autres touches aromatiques qui en font un élixir complexe et exaltant : le zeste d'orange, la rose, le miel et les épices de pâtisserie. Sa robe est intense, jaune avec des reflets dorés, il a tendance à être corsé avec une faible acidité et parfois légèrement pétillant.

En règle générale, le Gewurztraminer est non-boisé, la fermentation se fait en cuve d'acier, et il est produit en sec ou en demi-sec. Il existe des vendanges tardives de Gewurtz, généralement étiquetées en tant que telle (VT) ou Sélection de Grains Nobles (ce qui signifie que les vins ont été produits avec l'aide de la pourriture noble).

Universellement reconnu comme le vin d'accompagnement de la cuisine asiatique épicée, le Gewurztraminer s'adapte à de nombreux types de cuisines. En sec ou en demi-sec, le Gewurztraminer accompagnera parfaitement un canard rôti, les fromages à croûte lavée comme l'Époisses, un velouté de pommes de terre, des saucisses, une omelette au saumon fumé ou une pizza aux figues et au jambon de Prague. Le Gewurztraminer accompagnera parfaitement le foie gras, les tartes aux pommes ou n'importe quel dessert aux fruits tropicaux.","Littéralement traduit, Gewürztraminer signifie «Traminer épicé» et est considéré comme une mutation du Sauvignon Blanc.
les vins d'Alsace sont mis en bouteille dans des bouteilles de taille haute, en forme de flûte appelé vin du Rhin ou ""bouteille de vin du Rhin"". Ils sont connus comme ""bouteilles de jarret"".
Les vins d'Alsace sont fortement influencés par l'Allemagne, la nationalité de la région ayant changé plusieurs fois à travers l'histoire, de la France à l'Allemagne et vice-versa.
La dernière fois que ce changement a eu lieu a été pendant la Seconde Guerre mondiale, l'Alsace a été annexée par l'Allemagne en 1942 et n'a été retournée à la France qu'après l'invasion alliée en 1945.",fr
233,Spanish,Toro (Espagne),"Hailing from a small patch of land in central Spain, the Toro DO (region) produces a delicious wine called Tinto Del Toro.

Synonymous with Tempranillo, the region's chalky soil imparts some characteristics resulting in richness not normally experienced by other Tempranillos.

Toro reds must contain a minimum of 75% Tempranillo, and use other blending grapes such as Garnacha. The wine is often aged in American oak for varying lengths of time.

Considered the “Noble Grape of Spain,” Tempranillo has beautiful notes of plum, berries, cherries, and tomato on the nose and palate. One will also taste notes of tobacco, vanilla, herb, and leather resulting from oak aging.

This wine typically throws medium plus tannins, lower acid, with relatively medium alcohol. Pair this wine with red sauce pastas, polenta, pizza, and Mexican food. Reasonably priced, this wine is one to enjoy frequently.","Tempranillo has hundreds of clones. The one from Toro is simply one.
Evidence for wine cultivation in Toro dates back to the 1st century BC, while evidence for Tempranillo in Spain dates back to the 12century BC.
Toro reds ripen earlier that other grapes, and there is a lesser known version of mutant white Tempranillo, which is also very delicious.",es
247,Californian,Zinfandel (Californie),"While California Zinfandel can be produced in various styles, ranging from light to full-bodied, they all exhibit a certain fruit forwardness that is frequently described as “jammy”. It is also known for licorice, spicy and peppery notes.

Zinfandel has gotten a bad rap from the abundant jugs of cheap, pink “white zin” lining the bottom shelves of many grocery store chains. However, this grape variety produces quality red wines that are food-friendly, versatile and delicious.

Zinfandel is outstanding when paired with barbecued red meats and bold cheeses, as its strong flavor profile can stand up to robust flavors. The fruit forwardness of this bold wine is balanced out by medium to high tannins, lending the wine firm structure.

Some of the most prominent regions for producing quality California Zinfandel are Paso Robles, Napa Valley, Amador County, Dry Creek Valley, Sonoma and Lodi. Look for these regions when shopping for this all American wine to pair with your next barbecue.

Most California Zinfandels have a relatively high alcohol content, ranging anywhere from 14-17% abv, so sip (and hydrate!) accordingly.","The much maligned White Zinfandel was actually a mistake! It sold well, and thus, stuck around.
Most Zinfandel is sold as the blush variety – in fact around 80-85% of this grape is made into sweet blush wine.
Le Zinfandel est aussi connu sous le nom de ""Primitivo"" dans les Pouilles, en Italie.
Despite the variety's popularity, there is just over 70,000 acres planted, with the majority of it (over 50,000 acres) grown in California.
Le Zinfandel est planté dans environ 10 % du vignoble de Californie.",us
45,Chilean,Carménère (Chili),"A delicious, yet lesser known grape varietal, Chilean Carmenere results in fantastically beautiful, medium-bodied, fruit-forward wines. With gentle tannins, and deep crimson colors, you can expect an array of berries, red fruits, spice, smokiness and earth on both the nose and palate.

If you're into collecting, be aware that Carmenere is best enjoyed in the first couple of years after bottling.

Originally from southwest Bordeaux, France, Carmenere finds a hospitable home in central Chile. Today Carmenere grows all over the world, but the best renditions are generally considered to come from Chile. Now, comparatively little Carmenere still grows in France.

Carmenere is very similar to Merlot. In fact, until recently, Chilean wine growers mistook Carmenere for Merlot for decades.

With respect to food, Carmenere goes really well with menus containing savory flavors and spice. Enjoy a Carmenere with anything from steak to BBQ, to red-sauce pasta. However, try to avoid pairing any red wine with seafood.","La dernière syllabe de carménère se prononce comme ""y-air"".
Le Carmenere a commencé à Bordeaux, en France, et se développe difficilement en France maintenant.
Le Carmenere est utilisé principalement comme un raisin de mélange et a été confondu avec le Merlot pendant de nombreuses années.",cl
162,Nouvelle-Zélande,Pinot Noir (Nouvelle-Zélande),"New Zealand has received a lot of attention for their stunning, world-class Sauvignon Blanc wines, but maybe their most exciting wine is Pinot Noir.

These wines are direct and thoughtful, brimming with fresh red cherries, fresh cut roses, and a little bit of wet earth. These might be the best Pinot Noir values in the world!

The cool and beautiful countryside of New Zealand is good for more than just exquisite movie backdrops and Sauvignon Blanc. Over the past couple of decades, they have been quietly growing some of the most exciting Pinot Noir in the world.

Especially in Central Otago and Marlborough, New Zealand is crafting Pinot Noirs that are beautiful with their youthfulness, fresh fruit, and straight-forward nature.

The wines are not as complex as Burgundy, but they are also lighter than most California Pinots. You can expect light garnet-colored wines with fresh flavors of red cherry, cranberry, and red flowers complemented with soft, silky tannins.","Most New Zealand wines are at their most beautiful and best when they are young.
New Zealand's first vineyard was planted in 1851.
About 90% of New Zealand wines are sealed with a screwcap. The screwcap is often referred to as a Stelvin.
New Zealand is comprised of the North Island and the South Island and wine is made on both islands.",nz
209,Southern Italy,Vin blanc d'Italie du Sud,"Italy is responsible for some of the finest wines in the world, and while Northern Italy receives the majority of the plaudits, there is some excellent wine emerging from the sparsely populated southern regions.

Fiano and Greco are the two big white varietals in Campania and Basilicata, while Sicily has become known for their Bianco d'Alcamo, a dry wine made from the Marsala grape.

Southern Italy's reputation has taken a beating in recent years as they have become known for producing bulk wine that they can't sell, and the reputation seems to endure despite some lovely wine coming from Sicily, Campania and Basilicata.

Fiano tends to be a wonderfully creamy white wine with lots of green apple skin and pear. Greco, arguably Campania's flagship white grape, is a lot crisper, and typically has an abundance of minerality, lemon notes and pear.

The white wine of Southern Italy pairs extremely well with the creamy regional cuisine, as well as with some freshly caught fish or shellfish.","The Greco grape is thought to have been brought to Italy by the Greeks.
Italy is currently the largest wine producing country in the world.",it
8,Beaujolais,Beaujolais rouge,"Le Beaujolais est la zone viticole située la plus au sud de la Bourgogne. Sensiblement différente du reste de la Bourgogne à la fois par son climat que par le vin produit, le Beaujolais bénéficie de sa propre appellation.Le beaujolais donne des vins rouges légers et secs, fait à partir de Gamay. La région est surtout connue pour son Beaujolais Nouveau, un vin rouge frais et fruité fait pour être consommé immédiatement.Le Beaujolais est décrit comme un vin rouge rafraîchissant avec peu de tanins et une acidité vive. Des arômes de fraises et de framboises juteuses sont la marque de fabrique de ces vins. Les Crus Beaujolais évoquent des notes minérales et terreuses, ainsi qu’une touche d’airelles et de violettes.35 millions de bouteilles de Beaujolais Nouveau sont emballées et vendues à travers le monde dans les deux mois de la récolte. Ce vin est aussi apprécié pour Thanksgiving aux États Unis. Environ un tiers de la production totale de Beaujolais est dédié à la production du ""Beaujolais Nouveau"".La production restante est généralement étiquetée sous ""Beaujolais-Villages"". Il y a 10 Crus distincts qui proviennent de zones viticoles différentes.  Les Crus Beaujolais, contrairement aux ""Beaujolais Nouveau"", sont de couleur plus foncée, plus riche et plus complet et ils peuvent résister au vieillissement.Le Beaujolais Nouveau est un vin de table classique pour Thanksgiving—Il s'accorde parfaitement avec une dinde, une sauce aux airelles ainsi qu'un saumon fumé ou de la truite, des côtelettes de porc, de la quiche et de la charcuterie.","Le Gamay est un croisement entre le Pinot Noir et l'ancienne variété de Gouais.
Seulement 1% de la production annuelle du Beaujolais est un vin blanc, soit Chardonnay ou Aligoté
La région permet aussi une poignée de Beaujolais Villages en rosés de Gamay, toutefois il est assez difficile d'en trouver.
A l'origine, le Beaujolais Nouveau a été réalisé comme un vin pour satisfaire les vignerons, on le laissait fermenter seulement quelques jours. Ce vin de charme a explosé en popularité dans les années 1960.
Quand le beaujolais est devenu populaire, il a été célébré comme le ""vrai prince des bars et des bonnes tables"" dans les bistros parisiens.",fr
21,Bordeaux,Vin blanc de Bordeaux,"Bordeaux est la région la plus grande de France en production de vin qui abrite beaucoup de vins fabuleuxAlors que Bordeaux est mieux connu pour ses rouges, ou les ""clarets"" comme les appellent affectueusement les Britanniques, ses blancs sont de classe mondiale aussi.

La production de vin blanc à Bordeaux est plutôt rare, en comparaison avec des rouges, et comprend environ 11% du volume global.Mais ne vous inquiétez pas, il y a encore plus de 7 millions de caisses de vin blanc!

Comme pour les rouges, les bordeaux blanc sont pour la plupart des mélanges.La variété la plus commune est le Sémillon, suivie par le Sauvignon Blanc et la Muscadelle.Bordeaux est aussi une terre d'accueil à certains des plus célèbres vins de dessert dans le monde, des sauternes renommés sous-appellation et Barsac.

Les meilleurs vins blancs secs sont de la région des Graves, et sont généralement vieilli dans un chêne léger.Les Bordeaux Blanc possèdent souvent une vive acidité et des notes d'agrumes élégantes qui penchent vers le pamplemousse blanc.Ces charmant et brillants blancs sont exquis quand ils sont associés avec des pétoncles, du poulet rôti à l'estragon, des asperges, de la quiche ou des salades avec fenouil.

Les sauternes doivent leur profondes caractéristique grâce au Botrytis cinerea (ou Noble Rot, une infection qui provoque le dessèchement des raisins).L'association française par excellence au sauternes est avec du foie gras, du canard ou du pâté.Les fromages à patte molle et les desserts comme la crème brûlée sont vont aussi de pair.Les vins doux de Barsac méritent d'être explorées, et ont tendance à être moins cher.","Le Bordeaux blanc sec le plus prisé provient du Château Haut-Brion et va chercher dans les 1000$ par bouteille pour un bon millésime.
Le Château d'Yquem est le seul Sauternes classé en Premier Cru (ou Premier Cru Supérieur).
Thomas Jefferson aimait le Château d'Yquem, il a personnellement commandé 250 bouteilles du millésime 1784, ainsi que des bouteilles supplémentaires pour George Washington.
En 2011, une seule bouteille de Château d'Yquem 1811 a été vendue aux enchères pour 117.000 $, ce qui est le record du vin blanc le plus cher jamais vendu!",fr
266,Bordeaux Right Bank,Saint-Émilion,"Made predominantly from Merlot and Cabernet Franc, Saint-Émilion wines tend to have a rich, mouth-drying tannic structure, which is balanced by the more juicy characteristics of plum and black cherry fruit, along with chocolate and sweet spice, developing savory tobacco and cedar characteristics with age.

The best Saint-Émilion wines will exhibit a terrific mineral vein, the result of vines being planted on the region's limestone escarpment. Vines planted on sandy soils tend to produce grapes that make lighter styled wines.

Situated on the right bank of Bordeaux, the region of Saint-Émilion can boast of producing the most diverse range of styles, partly due to differences in soil types, from gravel to limestone to sand, but also thanks to production variations and winemakers looking to make their mark.","The village of Saint-Émilion is a UNESCO World Heritage Site.
Saint-Émilion was the first Bordeaux region to export its wines.
Saint-Émilion is Bordeaux's largest major wine-producing region.
Unlike other classified regions within Bordeaux, Saint-Émilion updates its classification roughly every 10 years.
In Saint-Émilion Cabernet Franc is referred to as Bouchet.",fr
